id,conversation_id,created_at,date,time,timezone,user_id,username,name,place,tweet,language,mentions,urls,photos,replies_count,retweets_count,likes_count,hashtags,cashtags,link,retweet,quote_url,video,thumbnail,near,geo,source,user_rt_id,user_rt,retweet_id,reply_to,retweet_date,translate,trans_src,trans_dest
1348970006722306048,1348970006722306048,2021-01-12 13:28:06 CET,2021-01-12,13:28:06,+0200,24744541,lemondefr,Le Monde,,La maternité de l’hôpital Bichat applique des règles strictes pour éviter les contaminations. Les futures mères se sont résignées à vivre seules certains moments clés de leur grossesse  https://t.co/KF7mF0Hcer,fr,[],['https://www.lemonde.fr/planete/article/2021/01/12/a-la-maternite-de-l-hopital-bichat-mon-angoisse-c-est-un-troisieme-confinement-je-me-dis-que-je-vais-rater-des-moments-de-vie_6065932_3244.html?utm_medium=Social&utm_source=Twitter#Echobox=1610443731'],[],4,11,18,[],[],https://twitter.com/lemondefr/status/1348970006722306048,False,,0,,,,,,,,[],,,,
1348897954711678977,1348897954711678977,2021-01-12 08:41:48 CET,2021-01-12,08:41:48,+0200,24744541,lemondefr,Le Monde,,"A la maternité de l’hôpital Bichat : « Mon angoisse, c’est un troisième confinement. Je me dis que je vais rater des moments de vie »  https://t.co/af310xGv9S",fr,[],['https://www.lemonde.fr/planete/article/2021/01/12/a-la-maternite-de-l-hopital-bichat-mon-angoisse-c-est-un-troisieme-confinement-je-me-dis-que-je-vais-rater-des-moments-de-vie_6065932_3244.html?utm_term=Autofeed&utm_medium=Social&utm_source=Twitter#Echobox=1610436495'],[],5,5,22,[],[],https://twitter.com/lemondefr/status/1348897954711678977,False,,0,,,,,,,,[],,,,
1329419346159005696,1329419346159005696,2020-11-19 14:40:46 CET,2020-11-19,14:40:46,+0200,24744541,lemondefr,Le Monde,,La FIFA va imposer un congé maternité pour les footballeuses  https://t.co/2YQlwehl79,fr,[],['https://www.lemonde.fr/sport/article/2020/11/19/la-fifa-va-imposer-un-conge-maternite-pour-les-footballeuses_6060370_3242.html?utm_medium=Social&utm_source=Twitter#Echobox=1605792510'],[],8,16,100,[],[],https://twitter.com/lemondefr/status/1329419346159005696,False,,0,,,,,,,,[],,,,
1319607589001416710,1319607589001416710,2020-10-23 13:52:20 CEST,2020-10-23,13:52:20,+0200,24744541,lemondefr,Le Monde,,"Accouchement « naturel » : les députés votent pour développer les maisons de naissance. « Une maison de naissance doit forcément être contiguë à une maternité, il n’y a donc aucune concurrence entre elles »  https://t.co/ZHbcqR4nM3",fr,[],['https://www.lemonde.fr/societe/article/2020/10/23/accouchement-naturel-les-deputes-votent-pour-developper-les-maisons-de-naissance_6057111_3224.html?utm_term=Autofeed&utm_medium=Social&utm_source=Twitter#Echobox=1603453940'],[],6,22,77,[],[],https://twitter.com/lemondefr/status/1319607589001416710,False,,0,,,,,,,,[],,,,
1308478207683973120,1308474673819201539,2020-09-22 20:48:09 CEST,2020-09-22,20:48:09,+0200,24744541,lemondefr,Le Monde,,"La mesure doit être annoncée par Emmanuel Macron mercredi et entrera en vigueur en juillet 2021. Une partie de ce nouveau congé devrait être obligatoire, sur le modèle en vigueur pour le congé maternité.  https://t.co/9fqnEJWMQG",fr,[],['https://www.lemonde.fr/societe/article/2020/09/22/la-duree-du-conge-paternite-en-france-va-etre-doublee_6053210_3224.html?utm_medium=Social&utm_source=Facebook#Echobox=1600800049'],[],6,38,155,[],[],https://twitter.com/lemondefr/status/1308478207683973120,False,,0,,,,,,,,[],,,,
1301201690687950849,1301201690687950849,2020-09-02 18:53:52 CEST,2020-09-02,18:53:52,+0200,24744541,lemondefr,Le Monde,,"Sophie Letourneur, réalisatrice d’« Enorme » : « La grossesse, ça ne se passe pas comme au cinéma… Je voulais désacraliser la maternité, parce que la sacralisation culpabilise. Beaucoup de femmes font des dépressions quand ça ne se passe pas comme prévu »  https://t.co/I2qy3zz89G",fr,[],['https://www.lemonde.fr/culture/article/2020/09/02/sophie-letourneur-j-ai-voulu-desacraliser-la-maternite_6050667_3246.html?utm_medium=Social&utm_source=Twitter#Echobox=1599044323'],[],6,28,76,[],[],https://twitter.com/lemondefr/status/1301201690687950849,False,,0,,,,,,,,[],,,,
1296045346473283584,1296045346473283584,2020-08-19 13:24:24 CEST,2020-08-19,13:24:24,+0200,24744541,lemondefr,Le Monde,,#Afghanistan : un « triangle » djihadiste à l’origine de l’attaque meurtrière d’une maternité à Kaboul en mai dernier  https://t.co/y5duYU4Zzi,fr,[],['https://www.lemonde.fr/international/article/2020/08/19/afghanistan-un-triangle-djihadiste-a-l-origine-de-l-attaque-meurtriere-d-une-maternite-a-kaboul-en-mai-dernier_6049326_3210.html?utm_medium=Social&utm_source=Twitter#Echobox=1597827692'],[],5,36,35,['afghanistan'],[],https://twitter.com/lemondefr/status/1296045346473283584,False,,0,,,,,,,,[],,,,
1293484124318171136,1293484124318171136,2020-08-12 11:47:01 CEST,2020-08-12,11:47:01,+0200,24744541,lemondefr,Le Monde,,"#MercrediCiné Chronique sociale dans une maternité en sous-effectif, « Voir le jour », de Marion Laine, inspire des sentiments mêlés.  https://t.co/FjlPIwkyc9",fr,[],['https://www.lemonde.fr/culture/article/2020/08/12/voir-le-jour-une-maternite-entre-quotidien-surmene-et-crise-existentielle_6048753_3246.html?utm_medium=Social&utm_source=Twitter#Echobox=1597218720'],[],4,11,10,['mercrediciné'],[],https://twitter.com/lemondefr/status/1293484124318171136,False,,0,,,,,,,,[],,,,
1291381611204874240,1291381611204874240,2020-08-06 16:32:23 CEST,2020-08-06,16:32:23,+0200,24744541,lemondefr,Le Monde,,"Donner le sein, sauver des vies, épisode 2 l A la maternité de Bangrin, on conseille aux mères de ne nourrir leur bébé qu’avec leur propre lait pendant les six premiers mois – et surtout pas d’eau.  https://t.co/Xvsy9acqO0",fr,[],['https://www.lemonde.fr/afrique/article/2020/08/06/c-est-naturel-sur-et-gratuit-au-burkina-faso-les-nombreux-benefices-de-la-tetee_6048268_3212.html?utm_medium=Social&utm_source=Twitter#Echobox=1596705399'],[],5,16,49,[],[],https://twitter.com/lemondefr/status/1291381611204874240,False,,0,,,,,,,,[],,,,
1288023204808871936,1288023204808871936,2020-07-28 10:07:16 CEST,2020-07-28,10:07:16,+0200,24744541,lemondefr,Le Monde,,La pandémie de coronavirus fait peser une nouvelle menace sur les femmes africaines en pénalisant l’accès aux services de maternité et à la contraception.  https://t.co/dHE7T7gV3R,fr,[],['https://www.lemonde.fr/afrique/article/2020/07/27/la-grande-solitude-des-femmes-africaines-face-au-covid-19_6047428_3212.html?utm_medium=Social&utm_source=Twitter#Echobox=1595918317'],[],3,44,58,[],[],https://twitter.com/lemondefr/status/1288023204808871936,False,,0,,,,,,,,[],,,,
1272808108197322757,1272808108197322757,2020-06-16 10:27:55 CEST,2020-06-16,10:27:55,+0200,24744541,lemondefr,Le Monde,,"MSF ferme sa maternité à Kaboul après l’attaque sanglante dont elle a été la cible. Parmi les victimes, 16 mères, dont 5 en plein accouchement, sont tombées sous les balles.  https://t.co/qiAtGd8wow",fr,[],['https://www.lemonde.fr/international/article/2020/06/15/msf-ferme-sa-maternite-a-kaboul-apres-l-attaque-sanglante-dont-elle-a-ete-la-cible_6042954_3210.html?utm_medium=Social&utm_source=Twitter#Echobox=1592295575'],[],37,311,238,[],[],https://twitter.com/lemondefr/status/1272808108197322757,False,,0,,,,,,,,[],,,,
1262823159742500870,1262823159742500870,2020-05-19 21:11:18 CEST,2020-05-19,21:11:18,+0200,24744541,lemondefr,Le Monde,,"A Kaboul, la maternité attaquée a vécu « un pur enfer »  https://t.co/y4R6fI6tg0",fr,[],['https://www.lemonde.fr/international/article/2020/05/19/scenes-d-horreur-a-la-maternite-de-kaboul_6040104_3210.html?utm_term=Autofeed&utm_medium=Social&utm_source=Twitter#Echobox=1589913921'],[],8,63,72,[],[],https://twitter.com/lemondefr/status/1262823159742500870,False,,0,,,,,,,,[],,,,
1261355147592036352,1261355147592036352,2020-05-15 19:57:56 CEST,2020-05-15,19:57:56,+0200,24744541,lemondefr,Le Monde,,« Ils sont venus pour tuer les mères » : des rescapées témoignent de l’attaque meurtrière d’une maternité de Kaboul  https://t.co/ZtOI9UiXRI,fr,[],['https://www.lemonde.fr/international/article/2020/05/15/ils-sont-venus-pour-tuer-les-meres-des-rescapees-temoignent-de-l-attaque-meurtriere-d-une-maternite-de-kaboul_6039826_3210.html?utm_medium=Social&utm_source=Twitter#Echobox=1589563133'],[],8,34,51,[],[],https://twitter.com/lemondefr/status/1261355147592036352,False,,0,,,,,,,,[],,,,
1247472870349037569,1247389489196040193,2020-04-07 12:34:43 CEST,2020-04-07,12:34:43,+0200,24744541,lemondefr,Le Monde,,"Dix nouveaux-nés ont été testés positifs au Covid-19 dans une maternité de Roumanie, à Timisoara. Les bébés sont en bonne santé et ne présentent pas de symptômes.  https://t.co/kIefJVEXT2",fr,[],['https://www.lemonde.fr/planete/live/2020/04/07/coronavirus-en-direct-1-150-morts-supplementaires-en-24-heures-aux-etats-unis_6035782_3244.html?highlight=1187563745'],[],3,46,42,[],[],https://twitter.com/lemondefr/status/1247472870349037569,False,,0,,,,,,,,[],,,,
1246695894025732097,1246695894025732097,2020-04-05 09:07:18 CEST,2020-04-05,09:07:18,+0200,24744541,lemondefr,Le Monde,,"France Télévisions enquête sur une accusation de harcèlement : « J’allais à Stade 2 en pleurant », a confié Clémentine Sarlat, qui explique avoir été marginalisée à son retour de congé maternité, jusqu’à ce qu’elle décide de partir.   https://t.co/x2AULN9zva",fr,[],['https://www.lemonde.fr/actualite-medias/article/2020/04/05/france-televisions-enquete-sur-une-accusation-de-harcelement_6035623_3236.html?utm_medium=Social&utm_source=Twitter#Echobox=1586070441'],[],27,147,214,[],[],https://twitter.com/lemondefr/status/1246695894025732097,False,,0,,,,,,,,[],,,,
1230863717925036033,1230863717925036033,2020-02-21 15:35:53 CET,2020-02-21,15:35:53,+0200,24744541,lemondefr,Le Monde,,"Une pétition conteste le licenciement de Yorgos Loukos, l'ex-patron du Ballet de Lyon, et des artistes menacent de retirer leurs œuvres de l’opéra. L’intéressé n’avait pas réemployé une ballerine de retour de maternité.  https://t.co/y2d5oJH4Go",fr,[],['https://www.lemonde.fr/culture/article/2020/02/21/des-artistes-menacent-de-retirer-leurs-uvres-de-l-opera-de-lyon_6030319_3246.html?utm_medium=Social&utm_source=Twitter#Echobox=1582289898'],[],3,9,35,[],[],https://twitter.com/lemondefr/status/1230863717925036033,False,,0,,,,,,,,[],,,,
1225856538021105665,1225856538021105665,2020-02-07 19:59:08 CET,2020-02-07,19:59:08,+0200,24744541,lemondefr,Le Monde,,Le directeur du ballet de l’Opéra de Lyon licencié pour discrimination pour avoir demandé le non-renouvellement du contrat d’une danseuse qui revenait de congé maternité.  https://t.co/WheOrPpSPv,fr,[],['https://www.lemonde.fr/societe/article/2020/02/07/le-directeur-du-ballet-de-l-opera-de-lyon-licencie-pour-discrimination_6028832_3224.html?utm_medium=Social&utm_source=Twitter#Echobox=1581097416'],[],4,79,215,[],[],https://twitter.com/lemondefr/status/1225856538021105665,False,,0,,,,,,,,[],,,,
1220476443886526464,1220476443886526464,2020-01-23 23:40:34 CET,2020-01-23,23:40:34,+0200,24744541,lemondefr,Le Monde,,L’administration Trump interdit les visas pour le « tourisme de maternité »  https://t.co/S4ojj7urSJ,fr,[],['https://www.lemonde.fr/international/article/2020/01/23/l-administration-trump-interdit-les-visas-pour-le-tourisme-de-maternite_6027025_3210.html?utm_term=Autofeed&utm_medium=Social&utm_source=Twitter#Echobox=1579818917'],[],8,39,67,[],[],https://twitter.com/lemondefr/status/1220476443886526464,False,,0,,,,,,,,[],,,,
1215207150886227968,1215207150886227968,2020-01-09 10:42:16 CET,2020-01-09,10:42:16,+0200,24744541,lemondefr,Le Monde,,"En Espagne, la crise économique, la hausse des loyers et la précarité de l’emploi reportent l’âge de la maternité et retardent le départ des 25-29 ans du nid familial  https://t.co/FjLYP4bkAl",fr,[],['https://www.lemonde.fr/international/article/2020/01/09/en-espagne-moins-de-bebes-plus-de-tanguy_6025242_3210.html?utm_term=Autofeed&utm_medium=Social&utm_source=Twitter#Echobox=1578552852'],[],2,51,75,[],[],https://twitter.com/lemondefr/status/1215207150886227968,False,,0,,,,,,,,[],,,,
1205469852288397312,1205469852288397312,2019-12-13 13:49:43 CET,2019-12-13,13:49:43,+0200,24744541,lemondefr,Le Monde,,"« Notre objectif, c’est d’accoucher les femmes dans des conditions maximales de sécurité. Aujourd’hui, ce n’est pas le cas. » : la maternité du CHU de Nantes saturée  https://t.co/028a4J3kvv",fr,[],['https://www.lemonde.fr/societe/article/2019/12/12/la-maternite-du-chu-de-nantes-saturee_6022624_3224.html?utm_medium=Social&utm_source=Twitter#Echobox=1576179554'],[],9,26,34,[],[],https://twitter.com/lemondefr/status/1205469852288397312,False,,0,,,,,,,,[],,,,
1204727577178525697,1204713955173773313,2019-12-11 12:40:11 CET,2019-12-11,12:40:11,+0200,24744541,lemondefr,Le Monde,,"@EPhilippePM ""La maternité sera compensée à 100 %"", promet @EPhilippePM. Comment ? ""En accordant des points supplémentaires pour chaque enfant.""  https://t.co/H2egtsZCIO",fr,[],['https://www.lemonde.fr/politique/live/2019/12/11/reforme-des-retraites-suivez-en-direct-le-discours-d-edouard-philippe_6022481_823448.html?highlight=1180824510'],[],2,5,6,[],[],https://twitter.com/lemondefr/status/1204727577178525697,False,,0,,,,,,,,[],,,,
1202253532671434753,1202253532671434753,2019-12-04 16:49:13 CET,2019-12-04,16:49:13,+0200,24744541,lemondefr,Le Monde,,"« On croise les doigts chaque jour pour qu’un accident ne survienne pas. » Au Blanc, les habitants toujours en deuil de leur maternité  https://t.co/r6jQhTI1MS",fr,[],['https://www.lemonde.fr/societe/article/2019/12/04/au-blanc-les-habitants-toujours-en-deuil-de-leur-maternite_6021552_3224.html?utm_term=Autofeed&utm_medium=Social&utm_source=Twitter#Echobox=1575471198'],[],1,10,19,[],[],https://twitter.com/lemondefr/status/1202253532671434753,False,,0,,,,,,,,[],,,,
1177155682518405120,1177155682518405120,2019-09-26 11:39:19 CEST,2019-09-26,11:39:19,+0200,24744541,lemondefr,Le Monde,,"Tous les films d'Ovidie ont en commun d’interroger la place du corps des femmes dans la société – dans le porno, la prostitution, à la maternité – et de l’examiner sous l’angle du politique. | par @AudreyAFournier  https://t.co/Cn7TIcHoR6",fr,"[{'screen_name': 'audreyafournier', 'name': 'audrey fournier', 'id': '76411453'}]",['https://www.lemonde.fr/festival/article/2019/09/26/ovidie-le-documentaire-est-un-sport-de-femmes_6013065_4415198.html?utm_medium=Social&utm_source=Twitter#Echobox=1569490758'],[],5,9,22,[],[],https://twitter.com/lemondefr/status/1177155682518405120,False,,0,,,,,,,,[],,,,
1176553100997513218,1176553100997513218,2019-09-24 19:44:53 CEST,2019-09-24,19:44:53,+0200,24744541,lemondefr,Le Monde,,"A #Lariboisière, la maternité « sous la menace d’un craquage complet ». « Si les conditions restent telles quelles, une catastrophe va arriver», mettent en garde 39 soignants du service de gynécologie-obstétrique de l'hôpital | @FrancoisBeguin  https://t.co/MSkYHux4QE",fr,"[{'screen_name': 'francoisbeguin', 'name': 'françois béguin', 'id': '33216225'}]",['https://www.lemonde.fr/societe/article/2019/09/24/a-lariboisiere-la-maternite-sous-la-menace-d-un-craquage-complet_6012868_3224.html?utm_term=Autofeed&utm_medium=Social&utm_source=Twitter#Echobox=1569343865'],[],5,62,29,['lariboisière'],[],https://twitter.com/lemondefr/status/1176553100997513218,False,,0,,,,,,,,[],,,,
1176468200642551815,1176468200642551815,2019-09-24 14:07:31 CEST,2019-09-24,14:07:31,+0200,24744541,lemondefr,Le Monde,,#Algérie Huit nourrissons meurent dans l’incendie d’une maternité  https://t.co/BCwiqu0Q4E,fr,[],['https://www.lemonde.fr/afrique/article/2019/09/24/algerie-huit-nourrissons-meurent-dans-l-incendie-d-une-maternite_6012851_3212.html?utm_medium=Social&utm_source=Twitter#Echobox=1569324696'],[],0,15,14,['algérie'],[],https://twitter.com/lemondefr/status/1176468200642551815,False,,0,,,,,,,,[],,,,
1172575126170345473,1172575126170345473,2019-09-13 20:17:50 CEST,2019-09-13,20:17:50,+0200,24744541,lemondefr,Le Monde,,Un projet de loi en faveur de l’émancipation économique des femmes devrait voir le jour en 2020. Nouveaux quotas dans les entreprises et mesures pour faciliter la reprise d’activité après la maternité sont au menu. Tour d’horizon des pistes envisageables.  https://t.co/OrVk8Vswyc,fr,[],['https://www.lemonde.fr/emploi/article/2019/09/13/vers-une-nouvelle-loi-pour-la-parite-professionnelle_5509767_1698637.html?utm_medium=Social&utm_source=Twitter#Echobox=1568398840'],[],6,30,58,[],[],https://twitter.com/lemondefr/status/1172575126170345473,False,,0,,,,,,,,[],,,,
1171780198947270662,1171780198947270662,2019-09-11 15:39:04 CEST,2019-09-11,15:39:04,+0200,24744541,lemondefr,Le Monde,,"🎬 #Cinéma « Tempo Comum », Susana Nobre filme la maternité pour de vrai ou presque. Notre avis : à voir  https://t.co/hZdW4YiGhG",fr,[],['https://www.lemonde.fr/culture/article/2019/09/11/cinema-dans-tempo-comum-susana-nobre-filme-la-maternite-pour-de-vrai-ou-presque_5508974_3246.html?utm_medium=Social&utm_source=Twitter#Echobox=1568197759'],[],0,3,11,['cinéma'],[],https://twitter.com/lemondefr/status/1171780198947270662,False,,0,,,,,,,,[],,,,
1145691744744476673,1145691744744476673,2019-07-01 15:52:52 CEST,2019-07-01,15:52:52,+0200,24744541,lemondefr,Le Monde,,"Dans le nord du Bénin, une équipe de footballeuses permet aux plus jeunes de sortir du statut de femmes fragiles ou vouées à la maternité. cc @collectifhuma Quand la pratique du foot se fait miroir de la condition féminine, lisez notre série de reportages  https://t.co/CdFdzaHk9r",fr,"[{'screen_name': 'collectifhuma', 'name': 'collectif huma', 'id': '626712148'}]",['https://www.lemonde.fr/sport/article/2019/07/01/a-gouande-les-gazelles-s-affranchissent-des-stereotypes_5483769_3242.html'],[],4,30,69,[],[],https://twitter.com/lemondefr/status/1145691744744476673,False,,0,,,,,,,,[],,,,
1138833799511453697,1138833799511453697,2019-06-12 17:41:50 CEST,2019-06-12,17:41:50,+0200,24744541,lemondefr,Le Monde,,"Un décret rend effectif l’allongement du congé maternité pour les travailleuses indépendantes. Porté à seize semaines, il est désormais aligné sur celui des salariées. Mais comment sont-elles indemnisées ?  https://t.co/zPBKj07sWe",fr,[],['https://www.lemonde.fr/emploi/article/2019/06/11/allongement-du-conge-maternite-pour-les-independantes-et-les-indemnites_5474499_1698637.html?utm_medium=Social&utm_source=Twitter#Echobox=1560352399'],[],2,12,25,[],[],https://twitter.com/lemondefr/status/1138833799511453697,False,,0,,,,,,,,[],,,,
1136596212805787653,1136596212805787653,2019-06-06 13:30:28 CEST,2019-06-06,13:30:28,+0200,24744541,lemondefr,Le Monde,,Nigeria : un « kit de maternité » au secours des femmes enceintes « Les accoucheurs traditionnels ne sont pas qualifiés. Ils n’ont jamais été formés et croient qu’ils ont un don pour l’accouchement »  https://t.co/xz3MI0CgpX,fr,[],['https://www.lemonde.fr/afrique/article/2019/06/05/au-nigeria-un-kit-de-maternite-au-secours-des-femmes-enceintes_5471992_3212.html?utm_medium=Social&utm_source=Twitter#Echobox=1559820628'],[],3,23,67,[],[],https://twitter.com/lemondefr/status/1136596212805787653,False,,0,,,,,,,,[],,,,
1131653175126167553,1131653175126167553,2019-05-23 22:08:36 CEST,2019-05-23,22:08:36,+0200,24744541,lemondefr,Le Monde,,"L’Espagne, refuge du « droit » à la maternité | par @sandrinemorel  https://t.co/WtnA0A4Bgt",fr,"[{'screen_name': 'sandrinemorel', 'name': 'sandrine morel', 'id': '120806253'}]",['https://www.lemonde.fr/societe/article/2019/05/23/l-espagne-refuge-du-droit-a-la-maternite_5466088_3224.html?utm_medium=Social&utm_source=Twitter#Echobox=1558631559'],[],2,31,54,[],[],https://twitter.com/lemondefr/status/1131653175126167553,False,,0,,,,,,,,[],,,,
1131579301311201281,1131579301311201281,2019-05-23 17:15:03 CEST,2019-05-23,17:15:03,+0200,24744541,lemondefr,Le Monde,,"L’Espagne, refuge du « droit » à la maternité  https://t.co/mqNVlNVqrC",fr,[],['https://www.lemonde.fr/societe/article/2019/05/23/l-espagne-refuge-du-droit-a-la-maternite_5466088_3224.html?utm_term=Autofeed&utm_medium=Social&utm_source=Twitter#Echobox=1558621413'],[],1,4,23,[],[],https://twitter.com/lemondefr/status/1131579301311201281,False,,0,,,,,,,,[],,,,
1121693031806070785,1121693031806070785,2019-04-26 10:30:33 CEST,2019-04-26,10:30:33,+0200,24744541,lemondefr,Le Monde,,"« Le chef de l’Etat joue sur les mots, un hôpital dont on ferme la chirurgie ou la maternité n’est plus du tout le même hôpital qu’avant », commente le géographe de la santé Emmanuel Vigneron.  https://t.co/6Oq4FzfHft",fr,[],['https://lemde.fr/2GB15tn'],[],11,75,101,[],[],https://twitter.com/lemondefr/status/1121693031806070785,False,,0,,,,,,,,[],,,,
1108614396538953728,1108614396538953728,2019-03-21 07:20:43 CET,2019-03-21,07:20:43,+0200,24744541,lemondefr,Le Monde,,"Le nombre de femmes en âge de procréer vivant à plus de 45 mn d’une maternité a doublé en vingt ans, selon une étude réalisée pour « Le Monde »  https://t.co/PRI6VN4eNh",fr,[],['https://www.lemonde.fr/societe/article/2019/03/21/le-nombre-de-femmes-qui-vivent-a-plus-de-45-mn-d-une-maternite-a-double-en-vingt-ans_5439049_3224.html?utm_campaign=Lehuit&utm_medium=Social&utm_source=Twitter'],[],12,86,69,[],[],https://twitter.com/lemondefr/status/1108614396538953728,False,,0,,,,,,,,[],,,,
1107655547149533184,1107655547149533184,2019-03-18 15:50:36 CET,2019-03-18,15:50:36,+0200,24744541,lemondefr,Le Monde,,La polémique enfle en #Tunisie après la mort de 15 nourrissons dans une maternité. Des médecins ont lancé sur les réseaux sociaux une page « Balance ton hôpital » appelant à dénoncer les dysfonctionnements du système de la santé publique  https://t.co/JvY4JEV33n,fr,[],['https://lemde.fr/2Ob6eMh'],[],5,41,34,['tunisie'],[],https://twitter.com/lemondefr/status/1107655547149533184,False,,0,,,,,,,,[],,,,
1104708942377172992,1104708942377172992,2019-03-10 12:41:51 CET,2019-03-10,12:41:51,+0200,24744541,lemondefr,Le Monde,,"En Tunisie, le ministre de la santé démissionne après le décès de 11 bébés dans une maternité  https://t.co/qk6TeQ82UM",fr,[],['https://lemde.fr/2u0yWWV'],[],4,43,53,[],[],https://twitter.com/lemondefr/status/1104708942377172992,False,,0,,,,,,,,[],,,,
1104030725941137408,1104030725941137408,2019-03-08 15:46:51 CET,2019-03-08,15:46:51,+0200,24744541,lemondefr,Le Monde,,"Le personnage de la sorcière « est une figure populaire, qui concentre tous les sujets qui se nouent autour de la question de l’oppression des femmes : le corps, la sexualité, la maternité, le patriarcat, le développement du capitalisme. » #rediff  https://t.co/JNIx4Pwcw2",fr,[],['https://lemde.fr/2XNdqSX'],[],19,70,118,['rediff'],[],https://twitter.com/lemondefr/status/1104030725941137408,False,,0,,,,,,,,[],,,,
1095282922108665856,1095282922108665856,2019-02-12 12:26:12 CET,2019-02-12,12:26:12,+0200,24744541,lemondefr,Le Monde,,"« Est-ce que notre santé vaut moins que celle des citadins ? » Saint-Claude, dans le Jura, un premier hiver sans la maternité  https://t.co/ABfAhxi6bz | par @FrancoisBeguin #abo",fr,"[{'screen_name': 'francoisbeguin', 'name': 'françois béguin', 'id': '33216225'}]",['https://lemde.fr/2WWGMOE'],[],2,18,30,['abo'],[],https://twitter.com/lemondefr/status/1095282922108665856,False,,0,,,,,,,,[],,,,
1057250711027757056,1057250711027757056,2018-10-30 13:39:46 CET,2018-10-30,13:39:46,+0200,24744541,lemondefr,Le Monde,,Fermeture de la maternité du Blanc : les forces de l’ordre évacuent les occupants  https://t.co/c2KT9dgXnQ,fr,[],['https://lemde.fr/2AB48QK'],[],3,17,25,[],[],https://twitter.com/lemondefr/status/1057250711027757056,False,,0,,,,,,,,[],,,,
1053389304297414657,1053389304297414657,2018-10-19 22:55:55 CEST,2018-10-19,22:55:55,+0200,24744541,lemondefr,Le Monde,,"Dans l’Indre, la mobilisation pour sauver la maternité du Blanc n’aura pas suffi  https://t.co/vfiVkLjwsA",fr,[],['https://lemde.fr/2CviZgD'],[],4,17,24,[],[],https://twitter.com/lemondefr/status/1053389304297414657,False,,0,,,,,,,,[],,,,
1044123701262909441,1044123701262909441,2018-09-24 09:17:43 CEST,2018-09-24,09:17:43,+0200,24744541,lemondefr,Le Monde,,"« En France, une salariée a droit à un congé maternité de seize semaines, dont huit obligatoires. Un salarié, lui, dispose d’un congé paternité facultatif de onze jours »  https://t.co/JrXKEh3KtN",fr,[],['https://lemde.fr/2zq936m'],[],5,57,104,[],[],https://twitter.com/lemondefr/status/1044123701262909441,False,,0,,,,,,,,[],,,,
1033975958108299264,1033975958108299264,2018-08-27 09:14:13 CEST,2018-08-27,09:14:13,+0200,24744541,lemondefr,Le Monde,,"« Je ne dirai jamais que le silence est un remède. Ignorer son fils ou sa fille qui a des tendances homosexuelles est un défaut de paternité ou de maternité », a-t-il déclaré.  https://t.co/L3Mvbpqdf8",fr,[],['https://lemde.fr/2BQdc6S'],[],105,119,162,[],[],https://twitter.com/lemondefr/status/1033975958108299264,False,,0,,,,,,,,[],,,,
